,Date,Score,reviews
399,2018年11月28日,4,希望多數角色可物攻魔攻 希望可以支援單手模式
356,2018年11月28日,2,排位機制 爛的可以 應該是強的配強的 爛的配爛的 每次都一個強 其他隊友四個爛到爆 一個強有用嗎 能一打五嗎 爛的已經很爛 輸也不會叫啦 強的配四個爛的 會幹死 一枝獨秀嗎
226,2018年11月28日,1,垃圾遊戲，網路每天都是良好的狀態 卻跟我說異常 要測網路的時候都跟我說出現小問題 到底三小問題啊？！
319,2018年11月28日,1,我的5隊5都很當，但網路沒有問題，還有我的好有全不見了，請你們儘速處理
318,2018年11月28日,3,如果東西不要這麼貴 遊戲不常自己關閉沒反應 我可以考慮給高分
317,2018年11月28日,1,更新後高楨率模式又不見了，是在歧視中階手機嗎
316,2018年11月28日,2,我覺得官方能讓腳色都能平衡，而不是為了賺錢失去平衡相對也會失去玩家
395,2018年11月28日,2,排位機制 爛的可以 應該是強的配強的 爛的配爛的 每次都一個強 其他隊友四個爛到爆 一個強有用嗎 能一打五嗎 爛的已經很爛 輸也不會叫啦 強的配四個爛的 會幹死 一枝獨秀嗎
131,2018年11月28日,1,"更新一些有的沒有,同隻愛里服裝要出幾隻顏色?排位名稱也學王者,既然要學王者怎麼不跟他們一樣開發王者吃雞遊戲。"
279,2018年11月28日,3,遊戲好玩，但檢舉系統腦殘，玩坦克吸收最多傷害，也死最多，還會被檢舉惡意送頭成功？
74,2018年11月28日,4,怪了 底下的留言很怪！配對到鬼隊友？如果你偶爾輸一兩場說隊友爛還說的過去！如果每次都輸你難道都不會覺得是自己的問題嗎？這麼巧？每次配對的對面都強你隊友的爛？
184,2018年11月28日,1,垃圾遊戲，網路每天都是良好的狀態 卻跟我說異常 要測網路的時候都跟我說出現小問題 到底三小問題啊？！
248,2018年11月28日,5,建議在排位選角方面，限定人物到達最熟練才能選取，無最熟練人物，不能打排位。在勝率方面的計算，希望排位是獨立計算，發送勝率時，在排位戰顯示的是排位的勝率
239,2018年11月28日,1,排位機制什麼時候要改 都沒在看評論 垃圾G社可以配到一堆鬼隊友我也是醉了
231,2018年11月28日,1,嗯……傳說開發人員是不是跟海綿寶寶作者一樣死掉了 突然終止就進不去 然後再扣我積分？？
285,2018年11月28日,5,這是一款真正的更新遊戲 第一個遊戲可以讓我更新到190%的 真棒哈哈
436,2018年11月28日,1,敵人7分鐘就投降 結果我被扣信譽點數 因為我玩輔助 0 0 0
53,2018年11月28日,4,如果可以不要一直把只會嘴炮的隊友配給我嗎？能不能開發一個黑名單系統，把莫生人拉黑讓我不會跟這些人匹配到？
638,2018年11月28日,3,有些英雄每次繳掉瞬移的時候，就會回到原地，可以請官方改一下嗎？
756,2018年11月28日,3,是不錯玩但是掛網的也太多了裝死的也有
755,2018年11月28日,5,這確實是好玩的，但是喜歡害人的太多，雖然我只是個低端，但，該怎麼玩我還是知道一點的
754,2018年11月28日,4,特產不要打不贏就一直嘴 自己廢要承認
475,2018年11月28日,3,更新後好友全沒了= =厲害 懶的說了 反正傳說就只能這樣
86,2018年11月28日,1,爛遊戲 每次更新沒一次準時 打排位說網路異常 閃退閃退在閃退 換了三個網路還在跟我說網路異常 請問是什麼意思 官方可以出來說明一下嗎 還有遊戲承諾是怎樣更新沒準時過的 傻眼
89,2018年11月28日,2,最近用手機開遊戲配對之後一直被斷連結是怎樣，訊號全滿，還顯示網路不穩？伺服器的問題還是我的，不懂欸，然後還一直被檢舉掛網，我也是醉了
199,2018年11月28日,3,遊戲配對機制可以在改進，還有檢舉系統真的爛，跟路人5排，隊友也打的很爛，結果4個路人同時檢舉我就被扣信譽積分了，傻眼……
93,2018年11月28日,1,玩家對戰有趣，需熟練角色即時操作反應，排位系統應該讓玩家預選主要以及次要路線，媒合組隊上才不會有問題，信譽系統需要在嚴格點。
115,2018年11月28日,1,更新後進去遊戲不到30秒就出現未知網路連接錯誤直接跳出去 試過關機重開換其他網路都一樣 根本不能玩?
517,2018年11月28日,2,遊戲更新顯示不到50MB 在這裡更新快1G 這是怎麼回事呢
122,2018年11月28日,1,技術性遊戲快變成台幣戰士遊戲了 新英雄要花錢才拿的到 而且夠無恥的 傷害根本做壞 勇都沒蘇無恥了
123,2018年11月28日,3,遊戲好玩，但普遍玩家素質低落 。 打越爛的越嘴砲，完全自信爆棚。 另外檢舉系統只有爛可以形容，形同虛設。
137,2018年11月29日,1,死官方現在我的好友全部都不見了是怎樣，還有動不動就閃退而且還重連不回來，愛里的新造型根本就是換顏色而已還賣那麼貴有沒有良心啊缺錢的廢物
142,2018年11月29日,5,更新之後變得很不順畫質也變的沒比以前好請改進，不然平安京可能等著我
180,2018年11月29日,2,怎麼打完一場，最後讀取會卡住？然後退出遊戲重開才會正常。 而且以前的好友名單不見了，也無法重新加好友。 （使用HTC手機）
183,2018年11月29日,5,這是怎樣明明已經下載到最新了，系統還是說已公佈最新版本，要去更新，煩死了還有，開始匹配的時候，只要一匹配到人，當全部的人都按同意，倒數數字還在跑，最後系統顯示正在連線，請改進，不然這款遊戲馬上檢舉下架
82,2018年11月29日,4,希望可以用個平手 讓雙方不加也不扣 不然有時打太久 都贏不了 很無奈 還有點查看雙方裝備 會閃退
188,2018年11月29日,5,閃退問題頻繁，載入跟高效能的遊戲（舉凡吃雞）都沒有此問題，尤其是在跑條以及選角介面容易閃退。角色平衡有待加強，應該去思考各段位玩家為何不玩某些角色（綜合近期推出的新角和地圖觀的改動），而非頻繁的改變一隻角色的特性，動刀可以大，但不要複雜。
193,2018年11月29日,1,欸欸欸！這遊戲是更新更到壞掉是不是？！ 為何更新完我的積分減少了？ 我沒掛網阿 我網路好阿！ 我都沒有退出阿！ 阿給我減積分是衝啥小叮噹？ 這遊戲是超級不U 要改掉這遊戲的錯誤好不好？！ 這很誇張！
196,2018年11月29日,4,可以優化索尼的嗎？ 我的針數會亂跳1 和59 團戰還掉到30幾 用高針模式打這樣太不合常理了，請改善 我是哪XZP 上一帶的超旗艦
75,2018年11月29日,2,"至從更新2.0之後的版本卡頓問題嚴重，容易lag,越更新越lag請趕快優化改善，要不然真的想改玩平安京或王者之類的遊戲"
90,2018年11月29日,1,幹你娘 打牌位 給我安排垃圾? 觀念差 一堆掛網 怪隊友 又送 垃圾G社可以安排跟我實力一樣嗎 不然我真的很難做人 很難到我想目地 還有流暢度給我改回來 爛死
124,2018年11月29日,5,我自己雖然才玩了3個月，但這款遊戲帶給我非常完美的遊戲體驗，遊戲裡的角色以及地圖都設計的十分精美，每個角色都有自己的特色，幾個角色之間還會有關聯，雖然我只是一個新手，常常被對手虐爆😂😂😂，但【傳說對決】是我最最最喜歡的遊戲。
260,2018年11月29日,1,幹這次什麼更新要選角直接崩潰重連又說未知連線錯誤什麼鬼TMD最好賠我榮譽積分喔！
225,2018年11月29日,1,為什麼更新之後就看不到自己遊戲好友了？ 重登入好幾次都是一樣 希望改進
784,2018年11月29日,3,網路不穩還需花錢買穩定系統實在太扯了吧！
711,2018年11月29日,3,我真的很想都給你滿分，可是改版更新後也太多問題了吧
630,2018年11月29日,1,今天傳說有問題，一更新進去好友都不見了，還會自己登出畫面，再來說我中退，扣我5分真的很不爽!😠😠😠😠😠😠
598,2018年11月29日,5,這個遊戲太神了，更新可以到187%，更新類型遊戲!（數據被多吃好多……）
593,2018年11月29日,2,剛更新完就一直當機，未知連線錯誤，怎麼重開都是這個畫面，直接刪了
591,2018年11月29日,1,改版後變lag卡頓了，如果為了遊戲花俏變得lag，將會失去越來越多玩家
559,2018年11月29日,1,糞game媽的我更新遊戲更新了一個小時都還沒好，幹
516,2018年11月29日,4,這次改版就不能開高幀率模式 希望全部手機都可以開高幀率模式
511,2018年11月29日,1,更新後網路一直不穩 常常當 是要怎麼玩 請官方盡快改進
201,2018年11月29日,1,一直輸是我爛還是你們做的爛 要不要給我一個十連輸的稱號? 我遊戲名是（GG惡魔大大） 你們大家都可以查 Garena公司要公平一點ㄚ
494,2018年11月29日,3,爛游遊戲老是讓人輸，一直陪屁孩隊友給人，不打塔只拿頭，只想當mvp
314,2018年11月29日,1,模式不是沒限時間，幹嘛又限時，這樣想玩沒得玩，可以全不限時嗎？ 配對惡意掛網的一天超過兩次就罰半天不能玩可以嗎，真煩
305,2018年11月29日,1,不是說更新會改好友介面嗎？ 進去一樣一片黑是怎樣？ 可以盡快修復嗎？ 以前都不會 搞什麼東西啊
289,2018年11月29日,5,我是使用華碩手機的用戶，為什麼改版之後設定中高幀率模式的選項就不見了
277,2018年11月29日,1,什麼魔法轉盤 用抽的還比買的貴是什麼意思 至少也來個保障吧 我花了1200來抽結果連動作都沒中 請給個表示
270,2018年11月29日,3,安卓手機的高幀率模式更新後不見了 希望能有方法改進 我還是喜歡傳說對決這遊戲
257,2018年11月29日,4,"新的英雄太,強原本是被公平5V5吸引來玩的可是感覺遊戲公司只想賺錢讓玩家買新英雄舊英雄玩不下去"
254,2018年11月29日,5,為什麼更新之後進不了遊戲 一直卡在23% 在還沒更新前卡在黑色畫面也進不去 不是手機問題 玩其他遊戲都超順沒有問題 希望改進這個地方 重載兩次很麻煩 我也是課金有5000不希望課金之後這個遊戲被說改版問題一堆不好評價
237,2018年11月29日,2,可否跟lol一樣排位先選好職業才打 不想跟一群搶英雄和路的垃圾一齊玩 如果一直都是這樣 這遊戲會變低質 打10場有7場都因為有人搶路而輸
233,2018年11月29日,1,今天改版後 我原本的遊戲好友都不見了 可以說一下這是為什麼？！
338,2018年11月29日,1,更新以後看不到好友，然後更爛，當當的也不是網路的問題，身邊朋友玩的人都一樣，越更新越怪又爛
67,2018年11月29日,3,儲值越多的人每次有活動抽什麼都要花很多錢抽 沒儲值過的 一堆1抽2抽就重 神秘商店抽打折也是 我有儲值的帳玩那麼久 沒抽到過1折 我沒儲值的 一直抽到1折 平衡一下好嗎 遊戲公司？
0,2018年11月29日,1,遊戲更新後 畫面被瀏海手機 擋住視線， 請正視問題 因該 或是可以多選項 讓玩家調整畫面 我的手機是 poco f1
799,2018年11月29日,4,您好，我是使用小米黑鯊手機，在遊戲內常常有觸控反應失靈的問題，想請您們針對此問題做解決。
1,2018年11月29日,1,把進攻 撤退 集合 改回來好嗎... 爆難用 然後更新完變有夠卡 跳舞系統是三小 不優化遊戲體驗 搞一堆有的沒得
30,2018年11月29日,3,更新完後玩傳說，為什麼有時會有朋友們但有時又看不到所有朋友在為什麼呢，常常說我網路不好，但是我玩任何遊戲好暢順，有時入傳說遊戲 所有的朋友都不見了為什麼呢？我都知道你們的更新是為了玩家着想的，但是這次更新有好有好多漏洞希望盡快改善。
66,2018年11月29日,1,更新玩遊戲跳出來進去還不給玩 一直跑配對錯誤 然後掉一顆星 品質還是一樣爛 反正也不會有人回覆 那這遊戲可以收一收了
34,2018年11月29日,4,陷免角色，會把本來有英雄的造型切回經典，建議修改。以及遊戲更新後我的好友名單消失了，重新加好友又顯示已為好友……都不能組隊打，請近期內修復
19,2018年11月30日,1,遊戲太高級 玩不起阿 明明都沒問題 他媽就出在我網路有問題 都可以跟別人打哈哈 就是不能玩這高級的遊戲
125,2018年11月30日,1,11月底 更新完 狂當機這樣是要怎麼玩辣！當機才來扣信譽 還只有在排位場才會出現
126,2018年11月30日,1,真的很爛 我每次開始按確定不給我選角 畫面卡在那邊 然後一直算我中離 害我信譽一直掉 這到底是你們的問題還是我的問題 請先搞清楚好不好 一直扣我信譽 你以為我想中離嗎
143,2018年11月30日,3,現在越改越誇張，我連釋放技能都不行了要放技能還得停下來不能走，有時侯走一下就停一下根本玩不了
146,2018年11月30日,2,為什麼更新好開始遊戲才給我斷線說網路錯誤是殺小
583,2018年11月30日,1,購買傳說會員得到克里希的造型使用途中，出現未知網路連結錯誤無法進行該遊戲，重複重啟也無法，買造型掉勝率的概念，至少補償要第一時間做到在把敗場移除，到底有沒有心經營該遊戲遲早把玩家會持續減少=.=
676,2018年11月30日,1,打人都不會痛，被打直接秒掉，誰還要玩這爛遊戲啊
783,2018年11月30日,1,靠北！訊號正常，配對完玩家後就不能連伺服器，這2天被扣到56分…………看！
553,2018年11月30日,2,到底在幹嘛 不小心按到退出 就說我掛機 勇者積分還全清空 真的受不了了...
189,2018年11月30日,3,為什麼我會閃退 我明明玩其他遊戲都不會閃 難道玩你們的遊戲還有買一隻更好的手機? 請快點改善這點
210,2018年11月30日,4,我覺得排位更新後的傳說戰力計算隊伍中如果有人掛機是不是可以不減戰力啊
40,2018年11月30日,1,今天一堆人的手機自動跳game，然後輸了還掉星?剛登進去結果又閃退?這要怎麼玩?然後輸了還被判掛網扣信譽?你們每次更新問題都一堆，不改善，又一直出造型，是有多想坑錢
232,2018年11月30日,1,真是爛遊戲，因為連線不上去就一直扣積分?不知道是我手機問題還是官方主機問題總結就是爛
5,2018年11月30日,3,打牌位打到一半突然寫網路問題但網路明明好好的這樣還扣我分數明明就你們的問題到底我為什麼要被扣給個理由好不好官方？
236,2018年11月30日,1,這家公司專門把，射手、刺客以外的角色搞垮，建議要載這款遊戲的玩家先三思，不要因為造型貴就買，不然會被公司的人當白痴
359,2018年11月30日,1,牌位都排到 惡意掛機 隨便玩的 練角 整體遊戲體驗非常不佳
512,2018年11月30日,1,更新之後一直閃退還進入平行時空的bug很誇張還不讓人連回去
507,2018年11月30日,1,為什麼每次更新完都會出現bug 我一直卡在匹配的畫面，完全動不了
54,2018年11月30日,3,"網路需求太高 滿格WiFi伺服器居然沒有反應，而且有些雞掰玩家掛網,不過聽說官方對這些垃圾和亂檢舉的要罰，可能能把屁孩帳封鎖"
261,2018年11月30日,4,我玩趙雲這角色還不錯 也有玩呂布 我玩傳說玩到現在有很多角色 出的越來越多 何時要出 關雲長和張飛這個角色 我好期待
15,2018年11月30日,1,都匹配給那種國小生看不懂字的那種 請問能把這遊戲改成有年齡限制嗎？😩 還有遊戲多了那些跳舞的我覺得都是多餘 或許這可能是想賺錢什麼之類的但可能會有反效果😒
276,2018年11月30日,1,在打牌位快晉升新牌位時閃退 本來可以好好打的一場被強制登出，請立即改善
747,2018年11月30日,1,剛更新一進排位賽就閃退，要玩什麼？重連還連不上去！！
292,2018年11月30日,5,打到一半突然整個卡住，動也動不了，明明網路很好，不就幸好我打的是經典，希望趕快改進
299,2018年11月30日,1,更新後把進攻撤退集合改成要兩次動作才能發號，87嗎，改成這樣一點都不即時
306,2018年11月30日,1,對戰開始，動不了，重開遊戲，進了桌面進不了對戰，網路關掉再開，我進去了，但也輸了，你說我掛網中離，又回來扣一半分數（-2），結果又一封掛網警告（-5），一場比賽扣兩次，而且還是你們讓我卡死的，好險上一場排位沒這樣子
726,2018年11月30日,5,很好玩更新之後進遊戲就一直斷線還被判違規
438,2018年11月30日,1,排位都故意配爛隊友給你贏一場輸兩場 打了6小時一直卡在同排位 很糟糕的遊戲根本故意害人
759,2018年11月30日,1,賺很多遊戲反而變得更糞，玩到一半突然斷線，還扣我信譽，我黑人問號，請問我儲值花錢是得到這種遊戲品質嗎？
748,2018年11月30日,1,更新後每次配對完成都會閃退必須從新登入，影響甚大
349,2018年11月30日,1,無緣無故爆ping問題不改善只會越來越少人玩 隔壁平安京這問題少很多
508,2018年11月30日,2,動不動就跳掉，差評 然後扣的信譽還是算我的 阿又不是我要跳的
56,2018年11月30日,1,笑死我網路滿格你們說我未知網路錯誤害我怎把掛機刪了無聊死了這種遊戲竟然能紅BUG一堆
227,2018年11月30日,1,為何她媽完全不能更新，都刪了快2GB的空間了，還一直要我刪東西讓出空間，真的是太誇張了，什麼爛遊戲，從來沒看過一個遊戲更新要花那麼多空間的
101,2018年11月30日,1,更新完超卡，有一場我跟朋友一起打，開場後結果他跟我的場次分開變成不一樣兩個場，我的朋友都變電腦人，結果排位都掉分，什麼奇怪bug
100,2018年11月30日,1,我真的很傻眼想打個牌位自己跳出去閃退是怎樣==害我掉星星還有隊友你們能付什麼責垃圾遊戲==你老師的
639,2018年11月30日,1,TM每次隊友都雷死了，這遊戲一堆屁孩千萬不要玩這遊戲真的爛死了，造型改顏色教你抽講一次還要100點券。這遊戲一起比較好玩先在玩不推
633,2018年12月10日,4,這個遊戲讓我在忙碌之餘還可以有這麼棒的消遣 和別人組隊很好玩還可以認識不同的人
28,2018年12月10日,4,我希望排位機制能改一下不要在讓大家一直搶角了，還有麻煩改一下批配機制不要連勝完就讓人一神帶四坑
476,2018年12月10日,1,玩家流失就找工讀生來衝線上人數是嗎！？很多ID就像是阿陸開發的遊戲裡的隨機取名機制一樣不可能是正常玩家會去取的 真是可悲
87,2018年12月10日,1,一直閃退爛死了又容易死機解除安裝又重新下載麻煩浪費時間真的是爛死了網路4G滿格網路很好為何還這樣手機也好好的也沒開什麼的就一直這樣真的很爛很爛欸真的是爛死的遊戲
515,2018年12月10日,1,玩家流失就找工讀生來衝線上人數是嗎！？很多ID就像是阿陸開發的遊戲裡的隨機取名機制一樣不可能是正常玩家會去取的 真是可悲
595,2018年12月10日,1,如果想氣死，就可以繼續玩這個遊戲，否則強烈建議換遊戲玩，系統配對，一堆送頭掛網，反應官方只會跟你說儘量讓兩隊差距相當，勝率各50%，送頭也就算了，掛網投訴也沒用，這是代表我隊友都很強可以4打5？？為何不把有掛網紀錄的連續20場都排一起，讓他們也體會一下別人掛網的感受？？消極處理的遊戲，只會出新角色騙錢
727,2018年12月10日,1,唉 傳說越改越爛我網路滿格結果還一只卡還被隊友嗆是怎樣
228,2018年12月10日,1,不只有我有這個問題，Samsung A7 2018每次匹配確定後，就未連線，麻煩官方盡快處理。
757,2018年12月10日,1,我覺得係統判定送頭有問題 不能因為死亡數多但擊殺數少就判定送頭 應該要在仔細一點 不然你想一堆不幫忙的隊友 趙雲打的贏前期就肥得跟豬一樣的瑞克嗎？
434,2018年12月10日,1,無良遊戲 玩家素質極低 牌位分段跟屎一樣 失敗至極的遊戲
388,2018年12月10日,1,"這公司沒救了，快把公司關一關吧！，寧願去玩王X榮X,死都不會玩你這一款"
386,2018年12月10日,1,爛爆 要贏一場有夠難 配對都配到一堆沒觀念的 到官網反應改善完全沒動靜 一開始真的很喜歡這個遊戲但現在完全厭惡到不行
636,2018年12月10日,1,不是有優化嗎?玩到一半就斷線閃退還扣榮譽!我很無辜誒拜託讓我有個遊戲體驗好嗎
385,2018年12月10日,1,我的手機是Samsung A7 2018問什麼都一直卡在配對畫面？…可以處理一下嗎
182,2018年12月10日,1,真的很誇張為什麼明明網路滿格卻不能遊玩很多三星A7玩家都反應為什麼還是不改善呢
554,2018年12月10日,1,什麼破系統連續五場都給我打都不會打的隊友，拜託都b了可以不要一直這樣亂匹配嘛？說好的雙方勝率50%都是屎根本沒有
70,2018年12月10日,1,目前換A7手機下載當天玩ok，下線後隔天就出問題，為了測試是手機問題還是網路？就這樣一直試信譽分掉到60分。 原來A7手機玩結束之後記得去清除資料，下次要玩就可以正常，不知道是遊戲不支援呢？還是手機問題？ 目前都是遊戲玩完結束直接清除資料。有沒有解救的方式呢？
742,2018年12月10日,1,到底給不給使用三星A7的人玩遊戲 網路滿格說網路有問題?
392,2018年12月10日,1,好幾次配對成功之後 突然就一直連不上 說手機網路異常 訊號明明滿格 害我信譽積分一直被扣
212,2018年12月11日,1,傳說很垃圾我花了一萬多卻抽不到愛李了輝煌難怪現在越來越少人玩傳說了煌 這也太坑錢了吧
85,2018年12月11日,1,傳說對決這款遊戲會挑手機 以前拿蘋果7Plus都不會有問題，自從換 三星A7 2018手機都不讓人玩了
252,2018年12月11日,1,12月12號維修完 還是一樣顯示網路出問題還是不能夠進去 玩遊戲 搞什麼東西
250,2018年12月11日,1,在打排位彈出遊戲 明明沒更新又說有版本更新建議退出遊戲重新登入 現在登不入去 是啥小
245,2018年12月11日,5,雖然很喜歡這個遊戲，但有可能要麻煩貴公司處理一些遊戲優化的部份，想必一定很多手機型號SAMSUNG-A7(2018)的跟您說了問題點了，麻煩請您盡快處理，謝謝😅
513,2018年12月11日,1,為什麼登不進去 登進去也是全黑 可以麻煩請官方修正一下嗎？ 這樣很麻煩ㄟ都不能玩 解除安裝後還是一樣到底是怎樣啦 可以麻煩盡快處理好嗎？
514,2018年12月11日,2,可不可以不要每次排位賽都是低端隊友 經典沒關係 排位賽系統也不看勝率 他媽40%也敢打 雷死人了 你這個系統做好 評分自然高 不然打排位隊友都是腦殘 這怎麼打
37,2018年12月11日,1,一堆掛機的，誇張的是連排位都在掛機，檢舉扣積分有用嗎？更誇張的是還有排位掛機玩家沒被系統紀錄(掛機沒丟勝率)！！結果其他四位認真玩的都被系統紀錄掉勝率！！！這樣玩屁啊～反應很久了，不囉嗦直接負評！等棄坑了
209,2018年12月11日,1,沒有原因的狀況下帳號一直無法登入，客服留言都不回，打客服電話，都不會有人接，FB線上留言也不回，很有問題的公司
59,2018年12月11日,1,刪除爛遊戲了 根本沒在審查就亂扣人積分 系統都偵測到沒給掛機獎勵，結果檢舉也沒回覆扣對方積分
230,2018年12月11日,1,剛剛開始排位開場了說我要更新不給我進遊戲，之後來看google沒更新檔？
708,2018年12月11日,1,維護完奧義全部被清空是怎樣 奧義要存很久 不可能這樣坑無剋玩家吧
43,2018年12月11日,1,排位打到一半跳出來是要玩家玩什麼，官方你們就是孬種拉沒能力，能不能給玩家一個安心的遊戲體驗啊
505,2018年12月11日,1,玩到一半說更新但有沒有更新，很糟的遊戲體驗。可能還會被扣積分欸
387,2018年12月11日,3,今天登入原本的帳號不見了 後來要我重新再創一個角色 第一個新手教學結束後又不能登入了 說連接不到私服器
207,2018年12月11日,1,更新好久哦 為什麼更新那麼久 每個都要更新 季節過了又要更新回來 很麻煩餒 想一下不要那麼麻煩 都更新很久
795,2018年12月11日,1,我覺得你們違規的評判是不是有問題? 只要別人檢舉都給過是嗎？ 我守塔 0死0殺0輔助 這樣也能被算違規??? 對方自己投降不滿 亂檢舉 也能過…太莫名其妙了吧
218,2018年12月11日,1,因為我每天玩的時間只有半小時偏偏現在維護現在大家也才剛下班正要玩為什麼不早點維護害我少一場
191,2018年12月11日,3,在一場排位中快贏了，結果直接一個大斷線，說什麼要更新 就不能等那場排位結束在說要更新嘛？這樣那場排位不就掉星了！？然後我出來更新結果根本沒要要更新的東西啊啊啊啊啊
259,2018年12月11日,1,都進排位賽了還退出說新版本沒更新，哪有要更新的版本啦，害到別人也害我被黑……
664,2018年12月11日,1,這更新是來搞笑的嗎? 更新之前有點卡，更新之後連登都登不進去，還有之前去平台寫了遊戲有問題的信希望改善問題，結果是什麼，根本都沒回，真的是不如以前了
