,Date,Score,reviews
423,2018年12月18日,1,為何新手機打牌位可以停止回應兩次 改版後三不五時方向鍵失去控制 莫名卡頓 到底是怎樣
550,2018年12月18日,1,那個為什麼要連輸的時候不會掛網，要連贏的時候就給我掛網為什麼？ 如果是這樣我大不了叫家人也一起刪掉不玩
781,2018年12月18日,1,網路明明就滿格，還斷網，不管用wifi還是自己的網路都一直斷，是要不要給人玩遊戲，是不能順一點歐，被檢舉都你們害的。
491,2018年12月18日,1,Samsung A7 2018一直無法進入遊戲 請問貴公司到底有沒有心要處理 已經很多人在留言區反應了卻一直得不到改善...
4,2018年12月18日,4,希望可以更改一下奧義的部分 實在太貴了 肝不出來那麼多錢 期望公司能夠注意這方面的問題 其餘的都很好
660,2018年12月18日,1,完全不喜歡，去看看人家王者榮耀的英雄，這裡畫的英雄，皮套有夠醜的，又貴
332,2018年12月18日,1,爛死了想要玩加玩就說阿網路滿格你說沒網路害我被扣分？垃圾遊戲。
541,2018年12月18日,1,為什麼用三星A7的都會有這種匹配配對就斷線，害我一直掉積分，根本沒辦法玩，麻煩請人出來解決問題的方案
500,2018年12月18日,1,新檢舉系統 很不歡迎回鍋或新手的意思 不打排位也出事 總之mvp會舉 隊友幾個認識的 手癢也會舉 要不要順便把輔助角色都抽走 喪心病狂了逆。
10,2018年12月18日,1,為什麼我三星a9也是遇到相同問題，配對完就網路伺服器異常？網路滿格，信譽都被扣光了，是叫我們不要玩？請趕快改善好嗎～
616,2018年12月18日,1,現在一直閃退是怎樣 可以改善嗎 這個問題不只一次了欸
374,2018年12月18日,1,為何新手機打牌位可以停止回應兩次 改版後三不五時方向鍵失去控制 莫名卡頓 到底是怎樣
623,2018年12月18日,5,明明就贏了為什麼我們這隊還是顯示輸了？更新之後並沒有變得比較好啊，而且瘋狂斷線，上線的時候早就掛了
204,2018年12月18日,1,到底什麼時候改進新款手機無法連線對戰被扣信譽分數的問題，賺這麼多錢改進動作如此慢?
244,2018年12月18日,1,搞什麼啊？跟電腦對戰一切正常，一打經典（搞得我不敢打排位）就斷線甚至還能夠一場斷5次，到底是要搞死誰？檢舉別人只會出現再觀察，自己被人檢舉立刻就扣分，到底還要不要繼續啊~
709,2018年12月18日,1,這個遊戲無緣無故閃退，我網絡明明連接得很好， 就這樣沒有了 兩粒星！ 麻煩官方修理好拜託！ 不然真的玩不下去了。
424,2018年12月19日,1,為何三星2018a7按準備後無法進入 重連又一直卡在那畫面 已經有很多人反應了請官方正視這個問題
336,2018年12月19日,1,馬的垃圾遊戲除了閃退還會幹嘛 每玩一場就閃退 糞Game快點倒害我花那麼多錢
619,2018年12月19日,1,剛剛我在打校園賽結果伺服器錯誤把我閃退還我們輸了 是不是要給點補償
778,2018年12月19日,5,可以弄個觀戰好友嗎？還有被莫名被扣信譽積分，標準怪怪的，沒中離沒嘴砲積極抵抗，還被檢舉，結果還真的被檢舉成功，有點不知所措
779,2018年12月19日,1,連死鬥模式都能惡意掛網，害別人扣分就算了，重點是檢舉根本完全沒用，只意思意思扣5分。很顯然官方沒有心要改善，玩家當然也沒有義務要有耐心等待改善。
498,2018年12月19日,5,我有在活動期間預購納克羅絲造型，可是為什麼還是要花710點卷才能得到造型，不能用預購過後打6折的416點卷買
703,2018年12月19日,2,傳說好玩是沒錯，但是這幾次開傳說都沒辦法打開，只能刪掉從新下載，下載要花很多時間，這點讓我不是很想玩下去，投訴過了，沒改進只給兩顆星
460,2018年12月1日,1,爛，什麼更新，優化的爛，網路明明就沒問題，唯獨就這遊戲狂爆ping，其他遊戲順到不行，搞什麼東西，進場時間也一樣，不能弄成大家同一時間開局嗎？有那麼難嗎？還是有賺錢就好，其他無所謂了？
251,2018年12月1日,1,配到電腦玩家太瞎了 官方這種管理模式根本毫無公平可言 檢舉系統也很爛
340,2018年12月1日,2,你們看到也回一下好嗎，你們這個遊戲不要一直欺騙遊戲玩家和消費者好不好，一直給別人輸，一直給別人掉勝率，一直給別人卡，一直給別人掉排，也不改動一下，爛遊戲，史上最爛的遊戲，小心點你們，我沒有開玩笑的。
425,2018年12月1日,1,爛，什麼更新，優化的爛，網路明明就沒問題，唯獨就這遊戲狂爆ping，其他遊戲順到不行，搞什麼東西，進場時間也一樣，不能弄成大家同一時間開局嗎？有那麼難嗎？還是有賺錢就好，其他無所謂了？
342,2018年12月1日,1,"斷線都重跑100%了,結果卡介面進不去?什麼狀況?還沒跑完遊戲都結束了,一般模式就算了,還牌位,遊戲都這樣子讓人掉牌的嗎？"
151,2018年12月1日,1,貴公司真der厲害簡單的遊戲竟然有人能玩的像低能兒一樣 貴公司能不能把這種水母玩家先知道這個遊戲是怎麼玩的再讓他們能跟玩家對決 不然就是讓這些水母玩家可以跟自己一樣水平的玩家打不要出來丟人現眼 一堆低能兒真的不知道這個遊戲是要五個人打五個人還是連自己的隊友也要堤防
479,2018年12月1日,1,隊友分配真的有夠爛在C遇到曾經S的你們到底會不會分啊？有那麼多錢連分對系統都用不好？？書一局兩局就就算了，居然排位連6輸？其中一堆敵人都有至少A排！我們勒？了不起就B2。能上google play排行榜感覺起來就像google的評審都是騰訊的人
68,2018年12月1日,1,你們官方一改版都不用測試的? 打一半就卡畫面 無故被殺 我換手機還是一樣問題 這樣甘願去玩王者
150,2018年12月1日,1,為什麼都一直跳出來 還說我沒網路耖 而且還一直卡 我網路還有餒 而且信號還佳 一直斷線是怎樣 拜託更新不要一直出現這個問題 行不行 打排一直輸 而且我打排位已經連輸二十二場 現在起可以把沒觀念的停止他們玩嗎 一直雷 現在又來一堆雷狗 又開始掉分
558,2018年12月1日,5,又更新了大家來裝外掛加我微博公众号492716###给载欧
393,2018年12月1日,1,爛死隊友爛死什麼匹配系統三小我已經從b3輸到c2我已經受不了刪遊爛系統
394,2018年12月1日,1,配對系統有問題，連3場我方遇到掛網，連2場敵方總戰績超過5千場，我方不超過8百，操作視野太小
397,2018年12月1日,1,我叫小火心我一直連輸是怎樣我現在連輸5場了要不要改啦廢死人的遊戲 爛，屁孩又一堆，很愛真對強者，真的是廢到笑的遊戲欸，我建意大家不要下載，你們的廣告也不用發了啦，廢～到～笑～。
785,2018年12月1日,5,垃圾傳說要不就直接收滾蛋，要不就不要一直閃退，連續兩次都不用玩？
679,2018年12月1日,1,"我有個提議，能否設定個牌位角色熟練門檻，就是將還未達到宗師的角色不能上場 ，像e排或a,s排可能不用，原因我不多說了，但我希望bc排可以"
354,2018年12月1日,3,更新後經常突然斷線 遊戲開始進入不了遊戲 來電時都會這樣發生 十分生氣 請處理
355,2018年12月1日,1,爛死了 奪寶也抽不到好東西 也不能檢舉好友 玩屁啊 進遊戲還是不同時間進去是要怎樣玩 還不改進玩家說的缺點 不如去玩大陸遊戲 這抽獎機率低成這樣要不要快的還我50點券？
197,2018年12月1日,4,改版完之後ms 一直亂跳不懂欸是要怎麼樣給玩家好的體驗，可以贏的一場比賽因為這樣變成輸的
116,2018年12月1日,1,剛進遊戲 就跳出 未知網路連接錯誤 然後重連後又閃退 媽的我連第一波兵都還沒清到
98,2018年12月1日,1,匹配到底有什麼問題，一堆智障隊友到底怎麼玩，順逆風都開送，自己失誤怪隊友，是怎樣，傳說要倒了嗎？問題有在看？？嗯？拜託貴公司管一下那些智障好嗎？只會做表面，不會覺得良心不安嗎？還是覺得只要賺錢就好了，嗯？
264,2018年12月1日,3,遊戲實質上是真的不錯，但玩家的素質真的也很差，判定言語辱罵根本無效，也讓人逐漸不想遊玩，未達年齡的玩家真的很多，希望能改善這方面的問題與檢舉系統
32,2018年12月1日,1,開始遊戲時就一直重連，而且又一直進不去，重開遊戲也沒用，我相信不是只有我有這個問題，你們一直不解決也沒關係，我就看到時候會有多少人因為這個情況而刪遊戲
198,2018年12月1日,1,你們繼續出狗角 出到破產最好 他馬的一個射手蘇傷害前期就已經那麼高 請問你們真的有平衡？ 你們有用腦做平衡嗎？
291,2018年12月1日,1,隊友為什麼都是出來嘴別人而已不做事，還實力相當的陪隊我看都是騙人的
297,2018年12月1日,1,垃圾遊戲 更新後爛到不行 打派重進了6次也是要重進 又不可意重開 爛
629,2018年12月1日,1,登入整個畫面都黑的你們是在做什麼啊，這樣怎麼玩遊戲，這遊戲越做越廢
439,2018年12月1日,3,請將以前的集合 撤退 進攻 改回三個鍵 不要因為那個對遊戲順暢度沒有幫助的跳舞功能而導致發信號上的種種不便 拜託了 老玩家在此懇求
132,2018年12月1日,1,爛的沒話說 網路沒問題一直斷我線 一直扣積分 現在還被檢舉到禁止配隊 真的很爛
177,2018年12月1日,1,玩到一半被伺服器退是怎樣，重登也沒辦法繼續進行遊戲，然後也要被扣遊戲積分是怎樣爛死
63,2018年12月1日,1,每次打牌位怎麼都是配到不會玩的低端，害我打牌都打的很心酸，尤其是掉星的時候還差點把手機折爛，結果害我段位低到爆
185,2018年12月1日,1,打個排位 一直爆p 整個玩起來就是卡卡 延遲 頓頓 不能修好一點嘛?? 要玩家打屁
296,2018年12月1日,4,"我的手機是vivo x20,這次更新以後遊戲都無法啟動，已經多次卸載重裝了，問題在哪裡呢？"
303,2018年12月1日,1,一直掉線哦，我才打兩下藍然後我就掉線了，還連不回來，一連回來，又出現連接未知網路，開著行動網路也會斷是怎樣
55,2018年12月1日,1,什麼遊戲素質隊友爛的跟什麼一樣還實力相同勒馬的想好好提升勝率都不行每場都這樣電腦都比玩家好至少會清兵、請官方好好想想怎處理這些低能配對系統
249,2018年12月1日,5,遊戲素質低 隊友只看勝率 大家只懂嘴炮 期待這遊戲被屁孩搞壞 遊戲機不平衡
398,2018年12月1日,1,不想讓人玩遊戲就說啊只會亂改遊戲說什么要讓遊戲平恆還不是在破壞遊戲平恆要改不改要修不修只會亂亂改網路滿格說什么460m排位會掉不只是雷友的問題雷友問題只占三分之一而已遊戲問題占了三分之二，垃圾遊戲
219,2018年12月1日,5,這遊戲很好玩，但是最近遊戲有點問題，以下是我看到遇到最多也最常出現的問題: 1.遊戲一直很卡很當，還會斷線 2.檢舉無效，但對方卻可以 希望官方能改善，不然不但不能抒解壓力，反而會讓人覺得煩躁，不能好好體驗
168,2018年12月1日,3,明明網路就可以用，配對的時候常常跳掉 害我信譽分數已經降到70一下了，又跟我說網路環境不好 可以想辦法解決嗎？？
592,2018年12月1日,1,登入整個畫面都黑的你們是在做什麼啊，這樣怎麼玩遊戲，這遊戲越做越廢
429,2018年12月1日,3,冬季改版，讓手機更當，上次全面優化好多了，結果這次又搞地圖，害我都不能好好玩，一直卡
104,2018年12月1日,1,動不動就跳掉不想想如何把遊戲設計好卻在那邊搞一些有的沒的爛模式爛功能設計者腦子有病嗎?
659,2018年12月20日,1,敗方MVP卡根本虎懶人的 明明MVP了還不給我用 是在騙人打牌位就對了嗎！
775,2018年12月20日,1,這遊戲 讚！ 屁孩還是沒被消滅66的
706,2018年12月20日,1,這遊戲越做越爛……觀念差的人還是一樣自我感覺良好 連排位分區越低越難爬 這是要讓人怎麼玩？ 一旦掉下去就永遠難爬了……
544,2018年12月20日,1,什麼破遊戲啊對面都連贏的我都連輸為什麼隊友都在掛機啊這什麼匹配方式？？會不會太爛了一點你有膽就封鎖我操爛死了
542,2018年12月20日,1,垃圾遊戲 打排位我方全部人斷線 對面沒斷 這樣也要扣我星 真的有夠破
375,2018年12月20日,5,傳說對決就是一個你隊友爛就會一直爛的遊戲你在怎麼強都贏不了你在殺人隊友在送的比你殺的多你五連殺了但你還是輸了的一各真正的戰爭遊戲
376,2018年12月20日,1,傳說對決 你去賺你們的錢吧 我不反對 高端場的對決 你們的隨機配對 都是給我那些低端場的隊友 只有一個字能形容 爛 我只能說 我不會在讓其他人支持傳說對決了
580,2018年12月20日,1,你們的何服器有問题?打排的時候彈game?能提供幫助嗎?對你們完全失去期望
656,2018年12月20日,5,傳統垃圾遊戲隊友天線寶寶對手復仇者聯盟打屁排位一堆低能輸出只會送頭怎麼玩
23,2018年12月20日,1,為什麼我samsung a9 剛匹配完就跳出手動連線 還不能玩 我的網路沒問題啊 重載也一樣 可以趕快修復嗎
581,2018年12月21日,1,都遇到掛機跟惡意送頭檢舉一直沒成功 別人亂檢舉成功 你們會不會去看 爛遊戲
736,2018年12月21日,4,這什麼爛遊戲阿，爛到爆的牌位機制，為什麼c牌會跟D牌一起打，一堆雷包送頭夠了沒，檢舉也沒用
704,2018年12月21日,2,我半夜用生命在打牌位的，給我連續四場遇到掛機的，可以給那些人懲罰重一點嗎，例如：從b掉c之類的
11,2018年12月21日,1,舉報沒有用，遊戲又lag，又多bug，匹配後又每次都過了十幾秒才能開始選英雄，倒計時還有十多秒就開始了，真不知道這公司有沒有用心過
489,2018年12月21日,1,遊戲當機重登就算了還跑不進去然後被算掛機還扣了兩次積分最後客服現在還不接單
458,2018年12月21日,1,為什麼從昨晚開始我都會登入遊戲後要開始對戰了又被退出 連接不到伺服器 線現在又變成帳號等入不進去一直說帳號密碼錯誤 搞什麼啊 變成都沒信譽了
26,2018年12月21日,1,前期你遊戲自己關掉怪我掛網輸出32％坦傷25％你說我沒在打隊友在送打個屁啊狗遊戲還扣積分甚麼鬼評分還掉我星吃我一張敗方 MVP卡
657,2018年12月21日,3,我剛剛登入的時候不知為何遊戲的畫面是模糊的，一開始以為是手機還是視覺問題，結果重開機重載後，一開始都正常了，結果在載入大聽是突然畫面破圖一下後又變成模糊畫面了，希望能幫我查詢原因順便解決，謝謝
705,2018年12月21日,4,這什麼爛遊戲阿，爛到爆的牌位機制，為什麼c牌會跟D牌一起打，一堆雷包送頭夠了沒，檢舉也沒用
538,2018年12月21日,1,你們的排位是不是有動手腳啊，贏太多就一直輸每次都有來亂的，你們還敢說傳說是公平的遊戲嗎能讓一些故意多次掛機或在遊戲中來亂的不要讓他們玩嗎
773,2018年12月21日,1,爛遊戲信譽積分規則和排位扣星制度真的爛死，我重連結果還被你們扣，真的傻眼，有沒有在做事啊 斷線重連那麼慢，爛東西，只會搞一堆花招，基本該改善的都不改，可以刪遊戲了，給我好好檢討改善，不然別想多拿一顆星
777,2018年12月21日,1,如果你鍾意同小朋友玩，隻game會令你係玩得好開心 總結: 好彩嘅話你玩得開心，唔好彩你分分鍾會delete隻game~
540,2018年12月21日,3,能不能增設黑名單拒絕接受同隊或對戰阿，一堆人被殺一次就跳遊戲的，還得讓那些人影響別人的體驗，這感覺相當糟糕
539,2018年12月21日,1,SNMSUNG A7根本不能完啊，網路滿格但我登進去時他自動連線吧啦吧啦就是不能玩的意思，好誇張
573,2018年12月22日,5,這是個好遊戲，掛網的處罰不會太重，但碰到不好的隊友是正常的。所以我覺得這遊戲沒有要改進的地方 不曉得為什麼大家要抱怨此遊戲？
702,2018年12月22日,1,垃圾遊戲，爛死了，爛隊友隊友一直送怎打，拜託下架好嗎，這什麼遊戲爛玩這個只會瘋而已，官方能下架嗎爛連打5場都輸，排位玩一般都贏排位就輸拜託下架別出一些廢物好？
575,2018年12月22日,2,為什麼換了A9手機。下載後第一次能完。隔天要玩。匹配後就斷線了。請幫忙。一直被扣信譽
734,2018年12月22日,1,關於排位能不能實力平均一點，想好好打遊戲都沒辦法，說什麼平均都50，結果就我一個50以上其他都50以下
721,2018年12月22日,4,官方我想要蘇可是沒錢儲值所以我可以把蘇放到傳說水晶的商店嗎
488,2018年12月22日,1,遊戲剛進去就完全不能動到最後輸了排位賽還要 扣星星然後還要警告我。這是什麼爛遊戲啊 很不爽了還要被警告我已經刪遊戲了我不想玩 這種這麼爛的遊戲如果官方看到我說的拜託你 請改進拜託
422,2018年12月22日,1,你們狗角可以在出多一點沒關係到時傳說就變成看玩的角色比較狗可以多出點狗角沒關係啦~現在角色葵輪狗到我都要退遊戲了
490,2018年12月22日,1,你們真的是夠了系統自己跑不進去在哪裡怪玩家我一直被檢舉一直被扣分什麼時候要修
615,2018年12月22日,1,為何我的小帳 鬼鬼(振宇）明明買的是上方的聖典卻變成下面的 官方最好還我點券
658,2018年12月22日,1,每次剛按準備他就是服噐連不到網路，但網路都滿格的，我的榮譽就一直被扣，還是沒改善
372,2018年12月22日,1,不錯網路滿格4G然後爆p 到460打三小電信別用遠傳貴又爛中華電信跟台灣大哥大是個好選擇
205,2018年12月22日,1,可以把奎倫停用或是大幅消弱，他隱形，完全不知道從哪裡出來，大招隱形還會回血，一進場，脆皮馬上蒸發，你的目的我猜應該是想讓玩家大幅退遊吧，那你可能快成功了。
373,2018年12月22日,1,打排位又一直閃退 網路到正常還一直退連回來都結束了怎麼玩 打到一半又當機排位很痛苦欸 快點改進好嗎
58,2018年12月22日,4,我用Samsung A7 2018 玩傳說對決時，叫我要檢查網路連結，但我用其他應用程式網路都是好的，很多人都有這個困擾，希望傳說對決官方可以解決這個問題
95,2018年12月22日,1,爛遊戲，牌位一直遇到垃圾。檢舉又能怎樣？還不是一直掉星，10場只有1場是好的，只能祈禱下一場是正常的
108,2018年12月22日,1,"這遊戲的配對可以再爛一點沒關係,就只會一直出造型幹，媽的s排都被你害到d 操"
776,2018年12月22日,1,關於排位能不能實力平均一點，想好好打遊戲都沒辦法，說什麼平均都50，結果就我一個50以上其他都50以下
206,2018年12月22日,1,今天是怎樣有的爆p有的登入遊戲畫面卡了十幾秒才能移動溫泉這樣玩什麼
456,2018年12月23日,1,說好的公平競技勒 隊友個個都是雷包 拜託打個排位亂選角 遇到的隊友都雷包對手都Faker你說這那裡公平別人一天爬好幾個段位我爬都都被隊友雷下來我求求你們匹配的係統改好點好嗎不然把雷包封鎖好嗎求你們
241,2018年12月23日,2,為什麼Samsung A7一直無法連線…… 配隊成功就無法連線，可以盡快改善嗎… 明明網路就很正常啊…還我信譽積分 請盡快改善處理
325,2018年12月23日,1,在用Samsung a9(2018)配對入場一直都是網絡不 穩定無法玩，可看影片還是正常的
457,2018年12月23日,1,網路很穩滿格結果一玩就爆頻 也不只一次可以修正嗎 玩這麼久一直都沒解決
421,2018年12月23日,3,今天12:33排位賽有出現異常 影響遊戲體驗 是否能檢查有無問題 無故斷線 從新連線後打沒幾分鐘就直接输了
698,2018年12月23日,3,這個遊戲很好玩 但是三星的手機用戶都會斷線或當機 希望官方能解決問題
535,2018年12月23日,2,三星a7 配對完進不去一直斷線換成Wi-Fi也不行，能盡快改善這個問題嗎。。。
731,2018年12月23日,1,打牌位都遇到低能隊友是要怎麼打拉? 對手都跟鬼一樣隊友都跟屎一樣，從來沒有輕鬆結束過一場，輔助打到mvp隊友就跟銅牌一樣，我都努力自己上金一每次都卡bo就偏偏給我腦殘隊友，到底為什麼，為什麼啊？
578,2018年12月23日,3,拜託你們的程式動不動就不回應害我斷線重連結束後又被扣信譽，你們的爛程式害到了許多人拜託快修理改進！！
577,2018年12月23日,1,牌位就只要按同意就可以打了，那幹嘛還要用那個東西，還是一樣啊裡面的人不是送頭就是掛機，我覺得你們官方根本就是浪費時間。
701,2018年12月23日,1,我想問一下 你們金幣難賺就算了 這我能接受但為什麼要限制賺取金幣上限？請說明原因
771,2018年12月23日,1,為了A錢出那什麼跳舞，把更重要的團隊指令弄成這樣，每次都會按到返回主畫面，給你斷線，這遊戲輸了就算了，直接破壞遊戲體驗，吃相難看，又用腳做平衡，只能說傳說在走下坡了
453,2018年12月23日,1,排位隊友分配真的很不均 連輸到不想玩了 場場逆風開局 有時候能靠自己打贏有時候不能 因為隊友實在實力差太多 不懂單排對面勝率都五十幾以上開頭 怎麼這邊隊友都四十幾 是要怎麼玩
62,2018年12月23日,5,換新手機三星a9後後進入遊戲按確認後就一直無法連線次服器……移除後重下載後會變正常可進入玩遊戲，但遊戲登出後再進入遊戲問題又來了……
774,2018年12月24日,4,不知道為什麼玩到一半 畫面整個變粉紅色 只看得到角色的輪廓 整場都這樣 傻眼……
329,2018年12月24日,1,三星A9也又有出現這種狀況但其他遊戲都不會 4G、信號都滿格卻斷線要我重連 退出遊戲重登還是一樣 關機重開也沒用 希望能快點解決這個問題 真不懂你們到底在幹嘛欸，從12/1號到現在， 都25天了，你們又在處理嗎？ 我們都知道，處理這些東西很麻煩，但你們至少要回應一下我們的問題啊！這麼多天沒一則回應， 難怪會掉排名！
287,2018年12月24日,2,換了三星a7在按組隊後就一直斷線重連，也連不回去，積分扣到不能玩，可以趕快改善嗎
84,2018年12月24日,5,遊戲不錯，建議可以讓我們在進牌位前事先選定路線，減少因路線爭議而導致不愉快，嚴懲中離或被多次檢舉玩家，給予優質玩家良好遊戲品質
772,2018年12月24日,2,到底為什麼打牌位有人掛機導致我們輸了還要掉星 別人掛機是我們的錯嗎？ 我覺得要改進
486,2018年12月24日,2,我覺得打牌位可以改一下 可以選自己的路 不是進去一大堆在搶角色 而且還送 一堆來亂的一直莫名奇妙的掉分！！
534,2018年12月24日,1,什麼電腦編什麼對爛隊友 都給我遇到871除大家不要玩
536,2018年12月24日,2,我覺的體驗的角色都不能體驗是造型已前都可以為什麼現在不行體驗我有這個角色造型也不能在這樣我就不玩這個爛遊戲
97,2018年12月24日,1,你們先現在是怎樣，你們公司害我在排位一直閃退，害我掉星，結果你們現在把我列入觀察名單，你們不覺得你們很惡劣嗎，我會適情況，看看需不需要告你們，侵害我權利，還這麼囂張
169,2018年12月24日,1,遊戲亂處罰人。問題一堆，只要現實的朋友3個就能檢舉你，玩傳說到不如玩王者榮耀。
700,2018年12月24日,5,真的有時候會進不去，整個黑螢幕給我，我檢查過網路還有別的東西，還有請減少罵人的機率，我常遇到一直罵人的隊友，挂網也是哦
371,2018年12月24日,3,今天一直顯示斷線 剛按確認不到3秒就斷線然後無法連回去了 網路測試其他遊戲完全正常 重下載也嘗試過了
655,2018年12月25日,4,我的畫面都是粉紅色的要玩3V3时都看不到英雄在等待打都跑完1～100%大家都開始了我都不能進去我只能掛雞然後就會被扣信譽積分希望這個問題能改善，謝謝
330,2018年12月25日,1,隊友就再爛一點 公平對戰是嗎 隊友這種鳥樣你說公平 每場隊友都跟殘障沒兩樣 有0星我一定給
764,2018年12月25日,1,爛遊戲，要不要改名叫斷線對決啊，關個通知就斷線，重連三、四分鐘才進去遊戲，糞
730,2018年12月25日,3,最近不管用wifi或行動網路都常常斷線，常常有10秒左右爆pin，而且整場都發生，請問我要怎麼玩？
733,2018年12月25日,1,很爛 牌位場根本是電腦操控的 怕你升星 排給妳一些9等呀14等的 牌位竟然是青銅...我都不知道要說什麼了.. 而且不是一兩場 是每一場 圖片我都有保存下來
533,2018年12月25日,1,我打牌位突然跳掉 還不給我重登是怎樣 太誇張了吧 想賺錢也不是這樣逼人儲 你們這樣還不如去搶
