,Date,Score,reviews
266,2018年12月11日,1,有更新？？排位選好角色，系統跳出來叫我更新但是都沒選項，重開也好多次，也是沒有，解除重新安裝遊戲後，帳號整個不見變成新號，這是？？？
746,2018年12月11日,3,玩很久了突然想打排位，但剛開始的時候很多都沒關念，常看到一路擠一堆人，又有走到對面塔裡送頭的，排位也很多人要搶打野又不會玩一直送養肥對面，這樣子專精輔助的很難打上去誒
390,2018年12月11日,2,不要下載 他更新完後 會要你再登入多一次 沒有更新時 我一撳入去他是自己幫我進入 所以我沒有記住 但現在他與我在登入多一次他令我忘記了密碼 所以大家不要下載 希望不要再有這個遊戲
391,2018年12月11日,3,希望可以讓角色傷害平均點以前花的角就調爛現在新角就調強用這樣的方式強迫買新角跟本慢慢的會沒人要玩
745,2018年12月11日,5,我傳說帳號登不進去，寫帳號異常，重輸fb帳號，進去登入，結果要重新輸入名稱，我怕按了帳號就沒了
749,2018年12月11日,1,什麼鬼我的帳號居然給我不見昨天看還好好的今天帳號不見了我玩了1年多的帳號我要瘋啦給我答案為何會不見
750,2018年12月11日,1,垃圾遊戲，連網不穩，掛機廢物一堆，懲罰一點效果也沒有。另外4個還是悶爆掉排位。 還不如去玩京或是王者
72,2018年12月11日,2,為什麼維修的時候不是在原本的凌晨，偏偏要在我們要玩的時候在維修， 大部分玩的都是學生早上要上課晚上能才能玩 就因為晚上維修讓很多人無法玩 而且還沒辦法 簽到!非常的誇張
751,2018年12月11日,3,為什麼今天用garena登，他說伺服器已關閉是什麼意思？昨天好好的今天就突然關閉？完全不能登，那我花了那麼多時間在這帳號上面不就前功盡棄了？還是說你們在坑錢？
345,2018年12月11日,1,什麼爛遊戲公司，玩到一半還會當機 去你娘的遊戲中還會失控要更新，爛設計
432,2018年12月11日,1,嚴重 敵方基地差3下摧毀 突然伺服器斷線然後說有更新 這場排位賽還沒紀錄 怎說得上好即時對遊戲 現在把我帳號刪除掉係咩玩法
671,2018年12月11日,1,真的很糟糕，沒有好的懲罰機制對那些嘴砲跟中離的人，一直在增加玩家難度，然後今天又出狀況，拜託請加油，都已經玩到刪五次這遊戲了
435,2018年12月11日,1,垃圾遊戲 更新完直接把我玩很久的帳號砍了
21,2018年12月11日,1,閃退問題可以快處理嗎？ 只要是新安卓的手機就閃退……搞什麼飛機……要更新就不重視新安卓嗎？那應該要還給我們什麼補償吧！ 到底維修好了沒……也給一下回覆啊 什麼時候要維修好新安桌呢？
76,2018年12月11日,1,遊戲中無預警跳出 說有新版本更新 來play商店看根本沒有 試了四五次還是一樣
668,2018年12月11日,1,打到一半跟我說要更新 檢舉也沒用 爛遊戲 可以刪了
304,2018年12月11日,1,打到一半就給我跳出然後說什麼要更新？？？？ 欸辛辛苦苦打你這個遊戲卻這樣給我搞，是不是爛 煩死了掉排好不容易要回去...... 趕快刪檔好了破爛遊戲。
302,2018年12月11日,1,什麼爛遊戲公司，玩到一半還會當機 去你娘的遊戲中還會失控要更新，爛設計
667,2018年12月11日,3,我前天開始玩的 同學帶著我打了兩三場 今天熟悉了各種功能後發現信譽值那邊有被扣過分。。是舉報屬實 而且還是第一天玩的！當時根本連操作都不會是要怎麼犯規？第一天就被扣分 表示森77 (￣へ￣) 再來就是今天登錄 居然叫我輸入名字來創建 差點沒飆三字經（╯‵□′）╯︵┴─┴ 你們就是這樣打擊新手的？
469,2018年12月11日,3,請問為什麼會一直閃退？ 閃退是要怎樣*？ 不是我的問題，手機^系統問題，but被罵的是我欸(？ 請盡快改善。
470,2018年12月11日,5,今天上完可剛上線結果在維護 我要領取領取的物品又沒了 不過這遊戲很好玩 希望上線後能拿到
471,2018年12月11日,1,打到一半說要更新是怎樣 突然跳出去還沒打完耶 然後之後又要被當掛網是吧 有沒有搞錯要更新至少要提醒吧 突然就不能玩打牌位的要怎麼辦賠我們星星嗎
290,2018年12月11日,1,12月12號維修完 還是一樣顯示網路出問題還是不能夠進去 玩遊戲 搞什麼東西
718,2018年12月11日,1,剛玩這款遊戲，玩到第三場我30殺結果贏了跳出來不算我場數，我剛剛打的都白打的感覺，怎麼賠我
555,2018年12月11日,1,"打排位打到一半直接退出 說版本更新要退出重連,重新下載還是進不去 還是去玩平安京好惹"
492,2018年12月11日,1,我剛剛回鍋，是聽到會送角色，玩了一場打不好，被嘴就算了，還被檢舉扣分，很不友善，難怪我當時退了
83,2018年12月11日,1,為什麼更新完我的帳號不見 我是用fb綁 儲了1000多元以上 名字☆呆萌♡魅☆ 幫忙一下
267,2018年12月11日,1,又斷線 好死不死 這場輸了又要掉牌位 煩不煩 怎麼補償 官方都不敢出來交代
502,2018年12月11日,1,一直卡屏能跟我們解釋嗎很誇張這款遊戲為什麼要一直改花錢買點現在卻不能登是在誇張再繼續這樣下去沒有人會玩了拜託趕快修護好嗎～
49,2018年12月11日,1,換了三星A9手機後完全不能玩，連續進去排位場就立馬斷線，然後又扣我積分，連一版場也是一樣，馬的咧現在到底是怎樣啦？你們系統現在是換新手機的都不能玩就對了？扣的積分和星星要怎麼賠償啊？回應啊不要裝傻啦，儲值消費還要讓玩家受這種鳥氣嗎？
632,2018年12月11日,1,為什麼叫我更新又不能更新 一直閃退 我才剛儲值完 遊戲進行到一班把我強制退出
178,2018年12月11日,1,12月11日4點41分當機我重新下載遊戲結果我的所有英雄都不見了這是什麼情形
786,2018年12月11日,1,維護個屁，常常也在維護，有比較好嗎？載入越變越慢，團戰越來越卡
787,2018年12月11日,1,無緣無故被檢舉還扣分……為什麼嘴砲的人都沒事反而不說話認真打的有事……是你們腦袋有問題嗎
159,2018年12月11日,3,系統優化不夠 對於安卓玩家進入選角永遠都輸蘋果手機 對此絕大多數安卓系統玩家感到非常不公平
156,2018年12月11日,1,我在打牌位 你給我退出說要更新 更新個屁 商店沒有更新的提醒 我牌位不見 你是要怎麼賠我?真的是爛公司爛遊戲
788,2018年12月11日,2,更新遊戲後在遊戲裡測試網路都沒問題 但進入遊戲對戰就ALG 之前沒這樣的 我還花錢得到 克里希限定造型 得到造型一直ALG 想退費了 現在沒有會吸引我繼續玩的理由 希望快快處理好 手機SONY (Xperia XZ
148,2018年12月11日,2,現在更新完就在騙錢了是不是 更新前我驚喜小鋪抽到2折角色28可以買 他們更新完變成98元是怎樣 傳說越來越爛了，越來越過分了
99,2018年12月11日,1,dllm 不停lag，好心整一整啦，滿格wi-fi係咁彈game，想打鋪都唔得，除咗出造型仲識啲乜，難怪比人叫做垃圾game
165,2018年12月11日,5,希望英雄可以以原價的半價賣出，還有假如自己有一個造型不要了！可以不需要任何點券就可以送別人❍ω❍
145,2018年12月11日,1,登不進去，我們約時間要打傳說校園賽結果給我們當掉，我們時間能約的就是這個時候你們來給我用這個...
597,2018年12月11日,1,想說剛剛好了去打牌位打到一半伺服器關閉又跳掉了 我的星 官方給個解釋環我星來
8,2018年12月11日,1,打排位打到一半也沒提前通知直接全部退出，應該是整個伺服器都這樣，我的星星最好不要給我掉，打到目前看來贏定了，垃圾公司垃圾伺服器
102,2018年12月11日,1,"糞遊一個，三星A7,A9玩家直接吃屎，反應幾天了，官方跟本沒有要處理，只想賺錢，出一堆造型有三小路用，玩家的心聲你們有聽到嗎？伺服器的問題你們有解決嗎？遊戲越做越爛，虧我之前還花了錢在貴公司上，結果你們公司只會讓人失望而已，退遊退起來。"
635,2018年12月11日,3,為何一直卡在資源畫面，我的網路空間什的都沒問題，為什麼本來好好的突然不能玩，請注意一下好嗎，客服到底有沒有在注意啊，難怪一直被嘴，什麼都沒搞好
119,2018年12月11日,1,配對後選完角色出現版本太舊或出現異常 之後為什麼我的紀錄全都不見了 請出來說明
794,2018年12月11日,3,遊戲本體ok，就只是簡易版的LOL，但是遊戲穩定度很不足，我人就在WiFi旁邊，還可以一直爆ping？難道都把網路配給比賽，而玩家隨便就好？
626,2018年12月11日,1,打到一半跟我說要更新 檢舉也沒用 爛遊戲 可以刪了
596,2018年12月11日,5,更新之後 玩死鬥 5v5...一直跟我說伺服器重練我都在網路基地台旁邊玩也是一樣 而且在大廳很當，希望你們可以改過來
557,2018年12月11日,1,可以告訴我我玩到30等的帳號變新手教學兩等帳號。。歷史記錄這麼多場該有的角色一隻都沒了。最好能打的出來
247,2018年12月11日,1,越來越坑錢 伺服器有夠爛打到一半還會跳掉無法登入遊戲 千萬別載 如果有顆星我一定給
556,2018年12月11日,4,我真的覺得很好玩，但我今天為什麼它突然叫我重新登入我同學的帳號還不見了，希望明天能還我們有的東西不要整個不見，如果不見我會檢舉，拜託不要讓我們失望
792,2018年12月12日,5,那個幻影激鬥為什麼禮拜一、日才開放，啊我儲聖殿這樣任務怎麼解，是在坑錢嗎，能不能一直都開放啊
665,2018年12月12日,1,從昨天晚上遊戲畫面變紫色到現在還沒好，客服處理的速度眾所皆知的慢，連進行遊戲也不行，可不可以請這批工程師滾回去吃自己？
29,2018年12月12日,1,昨天更新過後列隊按準備後就進不了選英雄畫面怎麼重連都連不上，還扣分扣到只能匹配電腦。
717,2018年12月12日,4,排位有很多人自己的已經是S牌了還開小號來打我們這些想升排的，配對可不可以好好配，我們這邊有E跟D但對方全部都是C4這樣合理嗎？
474,2018年12月12日,4,希望領好友金錢的功能 可以從比較久的金錢快速領取(7天前 6天前) 每次因為快速領取都從一天前開始 可是之前的都沒辦法先領 都要一個一個慢慢點 每天這樣有點煩人 希望能改進
468,2018年12月12日,1,三星A72018版 好幾次都顯示網路連線問題…… 但我手機上網功能一切正常
9,2018年12月12日,4,每次打排好幾場都是遇到亂選角以及亂玩的隊友，而且連續幾場隊友都是一直送頭型的，這個匹配隊友的機制好像在中等牌位特別在C排都怪怪的
463,2018年12月12日,1,維修前扣我信譽值後來又扣了一大堆讓我等到23日才能打排我看還是玩其他遊戲好了
214,2018年12月12日,2,ㄌㄙㄍㄓㄕ一堆成年人就像國小牲一樣，智商平均值低下，儲狗很囂張，隊友爛到炸，跟本沒素養，儲狗一大堆，雷包滿天飛，糞遊不推
2,2018年12月12日,3,不要一直怪隊友拜託 我手機爛，把所有東西都調最低之後才能玩，而且每次還都比別人30秒才進去，還不是爬到A排，這遊戲真的是靠實力的
7,2018年12月12日,1,維修過後 還是沒改善a7的問題啊 進去打排位又斷 又自動重連 又連不回去 是真的有在維護嗎？
389,2018年12月12日,1,遊戲除了爛還是爛 設計這款遊戲腦袋的人不知道是不是天才 沒人都給你配一些低能兒 早晚在一波攻擊的 別得意 垃圾客服收
753,2018年12月13日,2,請問我聖典到了60級了！為什麼不能抽聖典的命運輪盤？ 錢都花了請補償我！謝謝！處理好給你五顆星！iD: Boriska
584,2018年12月13日,2,最近有夠卡不知道在卡什麼意思的，現在傳說是怎樣維護成這樣就算了，補償沒甚麼誠意也算了，打個遊戲越改越卡，遊戲品質那麼爛，真的覺得可以把公平對戰撤回了
631,2018年12月13日,1,違規判定的標準是什麼？莫名奇妙就被判定違規而扣分，做了什麼違規行為也無法明確的告知，檢舉時的選項這麼多個，難道不能告知因為什麼原因被檢舉嗎？
176,2018年12月13日,1,很多人都練角色打牌位 不然就是掛網送頭 檢舉都沒用 真的不懂經營傳說的人是怎樣評的
473,2018年12月13日,1,我真心覺得 希望系統可以聰明一點 排100場沒好隊友只有自己一個打的很好 我真的不懂阿
134,2018年12月13日,1,遊戲自己當掉還扣星………排位玩到一半4G滿格，結果完全不動，很扯！！ 自己系統閃退還扣信譽積分，按對戰記錄又不顯示坑人啊！！！
300,2018年12月13日,1,打排位賽能改限制只能專精角色後才能打啊！排位賽遇到不會玩的新手玩家都會輸耶！或是限制此角色要超過200場次以上才能玩。
674,2018年12月13日,4,這次更新後又只會出現傳說對決四個字而已然後就黑屏了，可以改善一下這個問題嗎？之前也是這樣，這是更新完又這樣。我的手機是紅米note4
739,2018年12月13日,1,角色不平均，還有排位跟一般場一堆不會玩的，這遊戲根本靠隊友，隊友還一直送，是要我們連輸靠打電腦贏嗎
6,2018年12月13日,1,奧義被你們搞不見結果還了也只還各三顆這叫有還？無言大家一起投一星吧怎麼沒品質的遊戲給他下去
551,2018年12月13日,1,其他程式都可以用，為什麼會沒有網路，我的網路還是吃到飽欸，難不成a7不好嗎
673,2018年12月13日,5,你們官方要多出一點英雄，不然你們会倒。盛典的造型也很好看，希望排位可以不要有那麼多的屁孩
173,2018年12月13日,1,只有一句給你們聽 我帳號被盜 你們好樣的封掉 然後在補償 哇耖 我訊號不好 給人檢舉 你們要不要幫我補償一下 一年掛機都沒事的案例
752,2018年12月13日,1,玩到一半自動閃退，然後又扣信譽點數這樣根本就沒辦法玩，可以不要有香港人嗎？ 根本就不會玩
3,2018年12月13日,4,我的是三星A9剛開始玩不會 隔天玩可以登入但進入遊戲後就說伺服器連結失敗 又被扣了好幾分
121,2018年12月13日,1,網路明明很好 為什麼一直說從連伺服器……很爛欸 阿阿阿 希望趕快修好 我用的是A7 2018
339,2018年12月13日,1,檢舉機制真奇怪，我什麼都沒做也沒送頭也沒罵人，無緣無故就被檢舉，傻眼
548,2018年12月13日,3,這遊戲原本還不錯但奎倫出了之後根本不想玩了，在加上體驗服的新射手本來就夠強了，然後又出嗜血不就不用玩了?
586,2018年12月13日,3,這遊戲原本還不錯但奎倫出了之後根本不想玩了，在加上體驗服的新射手本來就夠強了，然後又出嗜血不就不用玩了?
213,2018年12月13日,1,連續10幾場都配給我智障隊友是怎樣 看人連掉星官方很爽 ？
462,2018年12月14日,2,我的傳說一直說網路有問題但我的網路滿格我還被扣信譽積分希望官方可以看一下不然我也不能玩我用的也是Samsung Galex A7 2018官方可以快修復嗎
258,2018年12月14日,1,排位隊友都很爛配對對面都強的還有鉑金的排位打下來虐人，傳說對決公司你告訴我怎樣才能贏，整場KDA最高也能輸，但對友一直匹配到廢物你告訴我怎樣才能贏，我是傳說對決的忠實粉絲，但是你們讓我失望了，越改越爛
223,2018年12月14日,1,網路滿格，連續卡了好幾天是三小啦！？都不敢玩一般跟排位！到底要不要改善？遊戲公司膨脹了嗎？
622,2018年12月14日,1,"遊戲如果要做成這樣就乾脆不要做,公司的服務品質爛成這樣,可以趕快倒一倒了,拜託你們不要在做這種遊戲,那些更新跟優化還有平衡跟本是坨屎"
735,2018年12月14日,4,部分角色讓人沒辦法有反應時間來應付 像有時候不到1秒就被刺客殺了，重點還是中期而已QQ
246,2018年12月14日,1,每一場一定會有人掛網，舉報跟本沒屁用，可不可以請官方做事，不然這遊戲跟本不用玩了
155,2018年12月14日,1,是怎樣啊我已經試了一個禮拜了都無法玩每次匹配時都說無法連接伺服器 網路品質是好的 匹配完後都不讓我進去還說我掛機而扣信譽積分 用玩家對電腦也一樣 現在是在整我是不是啊！ 搞得手機差點被我摔壞 這隻手機是 Samsung A7 前幾個禮拜才買的誒 都無玩對戰 連不上伺服器 網路買4.5G品質良好 就是無法玩 瞧不起我這隻手機是不是！！！
334,2018年12月14日,1,我手機三星A7 怎麼一直無法連線一直重連線害我信譽積分一直被扣 到底是在搞什麼
549,2018年12月14日,3,"現在輔助都沒有人權是不是，沒有死過而且助攻一堆竟然沒有MVP,一個死了好幾次只是擊殺比較多竟然MVP,MD以前根本不會這樣，現在是怎樣，會殺人就比較了不起是不是"
77,2018年12月14日,1,我用Samsung Galaxy A9 匹配完之後馬上跳連線失敗，網路100%沒問題，重開機也連不上，信譽積分快都被扣光了，請快處理，也把積分還給我
585,2018年12月14日,2,為什麼我明明沒怎樣系統一直說我有違規，都已經被扣到沒辦法打排位了，拜託處理一下扣分機制好嗎，不然都玩不下去了。
467,2018年12月14日,1,一直黑屏沒有辦法進去，重新下載也還是一樣，請問是系統維護失敗嗎？
713,2018年12月14日,4,我照我的方式打但是一直被假投訴，可不可以將投訴系統廢除，不然的話我的信譽一直掉，雖然很好玩，但如果再不改我就刪除這遊戲。
42,2018年12月14日,1,媽的 真的是糞game 一堆低能就算了 塔拉是三小 技能會耗費8%血量媽的 也太多 凎用技能還沒打到人就先殘
466,2018年12月14日,1,幹你娘吃屎專業團隊 都吃屎长大 舉報也没用 中離是不会管制
379,2018年12月14日,1,TM智障隊友每場遇到都打一些沒用的團還不幫扛傷兵也不清讓他們繼續玩跟本是污辱這個遊戲難怪很多人都不玩了
224,2018年12月14日,1,垃圾遊戲，隊友素質有夠差，你們的檢舉系統似乎沒用，就算是改版了也是一樣沒用，乾脆撤掉算了，沒屁用！！！
501,2018年12月15日,4,可否麻煩在開一次 蘇的活動 剛辦完遊戲 好多人都希望在開放一次蘇的活動 讓12月沒遇到的人 再一次機會 一次幸福的機會
503,2018年12月15日,1,拜託更正網路訊號好嗎？，明明是滿格，結果每次打排都在460是要玩什麼，出去就被殺...
741,2018年12月15日,1,你們遊戲有漏洞然後系統判定我的問題？？還扣我的積分是怎樣玩一場遊戲遇到問題還要算我衰就對了
663,2018年12月15日,1,為什麼三星A7打了一場就不能再打了，一直跳出自動重連，連好又跳出連接伺服器失敗，這樣到底要怎麼玩
179,2018年12月15日,1,檢舉的存在有跟沒有一樣 而且說好以實力匹配 但根本沒有吧 隊友真的爛到無話可說 輸到快崩潰 就只玩這遊戲結果是這樣特結果 恕我直言這遊戲對現在的我覺得真不好
666,2018年12月15日,1,打排位遇到態度消極的玩家明明就要贏了 。結果只是沒給他MVP而已直接叫別人全按投降。請官方改進。此玩家叫【DEJun】
506,2018年12月15日,1,換了新手機samsung a7 2018 玩傳說的時候剛匹配玩一直說網路重新連線我明明滿格……還我3顆🌟拜託改善謝謝
378,2018年12月15日,1,我又沒怎樣就一直被舉報一直死就一直被舉報一直送頭也一直被舉報我就新手不會玩高手都不會懂新手的心情新手一直被虐就覺得很不爽有是不能玩也被舉報這遊戲道底是怎樣啦
337,2018年12月15日,2,希望可以讓大部份的手機開高禎模式 不然都無法正常玩 整場當到極點 前一個版本還能開 現在卻都不行
427,2018年12月15日,3,有陣子 明明沒有開外掛 卻被檢控扣信譽積分 仲有有一點 特爾安娜絲的被動真的是屎到一個難點 他的二技有沒有什麼的用處 求新增設一些位移技能
547,2018年12月15日,5,請新手玩家達到4級按左上角頭像下方會出現邀請碼請輸入CzL9Dp會得到非常好的限量禮品價值不斐，一起來玩吧，只到12/17
590,2018年12月15日,5,這個匹配的系統會不會太爛的點，每次打排二十場有十九場，都有人掛機，該說我倒楣還是分配機制爛的要死
426,2018年12月16日,4,很誇張到youtube看解說再回來玩整個遊戲就當掉換個裝備也要跑按幾次都一樣
740,2018年12月16日,1,匹配的時候為什麼看對面是之前的s排而我方都沒有很高排位的我覺得匹配系統不好，還有在打排位的時候隊友總是送頭、送塔、投降、罵人，讓整個體驗打到不好的狀態希望官方能改進.
707,2018年12月16日,1,馬的 網路滿格還給我閃退然後快連線進去的時後又給我閃退 給不給人玩啊
331,2018年12月16日,1,馬的，奎倫在不改弱要刪遊戲了，攻擊那麼強又可以隱形跑的又快打屁哦？
552,2018年12月16日,5,我覺得很好玩可是最近 一登錄 玩遊戲開始卡 然後又把我積分扣的很低 根本就不是我的問題
738,2018年12月16日,4,能不能失敗扣積分1分就好因為有時候有急事就口那麼多拜託了🙏🙏🙏
617,2018年12月16日,1,信譽積分一場扣兩次是怎麼，還有隊友玩到一半掛機的也沒處罰，不愧是垃圾遊戲不意外
543,2018年12月16日,1,遊戲爛帳號每次莫名奇妙都登入不了也沒辦法從新設定密碼已經從新辦三次了客服更爛永遠沒人接
495,2018年12月16日,1,奇怪欸 不是牌位連輸就是隊友掛機 你們要不要乾脆把遊戲關起來不讓人玩算了
496,2018年12月16日,3,排位賽拜託不要在玩家滿星的時候給我排到一群低勝率隊友好嗎 難道不能有正常一點的配對系統嗎 等到你們改回來才是我所想要的傳說對決 現在已經不是了
497,2018年12月16日,1,白痴喔幾掰一堆隊友不幫忙對方很強叫他們集合不集合白痴不能讓屁孩退游嗎
618,2018年12月16日,1,隊友素質可以一致麻，超雷躺分掛機一堆，再不改善就退遊了
710,2018年12月16日,1,獎懲機制極差，認真打沒有任何獎賞，掛網送頭的處罰跟比抓癢還癢，打個兩場信譽積分就賺回來了!
499,2018年12月16日,1,妳們做的那種檢舉有用嗎？ 一堆奇怪的人不會玩還玩 我們檢舉有用嗎 可以說一下嗎
383,2018年12月16日,1,爛爆 輔助探視野死掉就被檢舉送頭 官方還確認是事實 核准的標準就這麼無能嗎 這樣檢舉還成立 請問你們的標準到底怎麼訂的
382,2018年12月16日,1,打個排總是遇到渣 批配機制可不可以好點 打的認真 玩的心累 一直輸 低能一群 智帳如雲
545,2018年12月16日,1,白痴喔幾掰一堆隊友不幫忙對方很強叫他們集合不集合白痴不能讓屁孩退游嗎
780,2018年12月16日,5,可否在嘛煩一次 蘇的活動 剛辦完遊戲 有好多人希望在開放一次蘇的活動 讓12月沒遇到的 在一次機會 一次辛福機會
662,2018年12月16日,1,剛換三星A7一開始玩都好好的 後來直接斷線不給連?玩其他遊戲都不會這樣就傳說不能連線?被迫中離還扣信譽不會太誇張嗎==
546,2018年12月16日,1,連續五場排位全隊友練角，兩場一般打野掛機，這要怎麼玩
377,2018年12月16日,1,到底為什麼都能排到智障隊友 永遠都會拍到低能兒 能不能給我個解釋 然後檢舉到底有沒有用我真的看不懂 低能兒那麼多 檢舉了永遠沒有效果
149,2018年12月16日,2,傳說 遊戲官方就只會找一些會玩的上去打線上遊戲我就說他們得名啊他們怎樣怎樣怎樣的 你有沒有自己去看一下多少人留言給你們 不去想不去看大家花了那麼多時間心血花錢玩的遊戲你都一直不處理現在是怎樣 剛剛有看到你們的地圖 知道在哪裡 請朋友過去嗎幹掉你
461,2018年12月16日,1,評分機制有夠爛 掛網處罰也很爛 還出什麼分期系統 整天想賺錢 遊戲爛的跟什麼一樣 掛機罵人 扣幾分跟電腦打個幾場又可以去牌位鬧 一堆傻
625,2018年12月17日,5,下午三點玩帳號還好好的 五點登入帳號被洗白，玩這麼久儲也不少就這樣沒了，請官方還原帳號
589,2018年12月17日,3,可不可以把撤退集合改回原來的按鈕鍵嗎？新版的很難操作，結果大家反而更少交流，失誤或默契沒抓好更多，還有不要把趙雲再改了，越改越爛
582,2018年12月17日,1,為何我無法進入遊戲，一點進去就整個都黑的
493,2018年12月17日,1,一直被強退，回不去還被扣分，後來還一直說安裝包不完整，改完後還一直當爛遊戲
587,2018年12月17日,1,搞不懂早上明明可以玩下午打開時先顯示傳說對決然後螢幕就一直是黑的，是怎樣
737,2018年12月17日,1,已經沒有價值性的遊戲了，當初買的造型，後面又出來。已經花了快23萬，奪寶始終都160已上才抽到。朋友都不到50抽就抽到，還一次這樣情況抽到3科，心裡不平衡。
